{
  "item_id": "cand-okonkwo",
  "searches": 22,
  "fetches": 18,
  "minutes": 57,
  "sections": {
    "identity": {
      "searches": 2,
      "fetches": 1
    },
    "prior offices and public service": {
      "searches": 1,
      "fetches": 1
    },
    "occupational history": {
      "searches": 1,
      "fetches": 1
    },
    "education": {
      "searches": 1,
      "fetches": 1
    },
    "campaign funding": {
      "searches": 2,
      "fetches": 1
    },
    "record vs rhetoric": {
      "searches": 1,
      "fetches": 1
    },
    "positions in own words": {
      "searches": 1,
      "fetches": 1
    },
    "debates and forums": {
      "searches": 1,
      "fetches": 1
    },
    "party": {
      "searches": 2,
      "fetches": 1
    },
    "endorsements": {
      "searches": 1,
      "fetches": 1
    },
    "outside spending": {
      "searches": 1,
      "fetches": 1
    },
    "attendance": {
      "searches": 1,
      "fetches": 1
    },
    "financial disclosure": {
      "searches": 1,
      "fetches": 1
    },
    "term limits": {
      "searches": 1,
      "fetches": 1
    },
    "promises versus record": {
      "searches": 1,
      "fetches": 1
    },
    "questionnaire answers": {
      "searches": 1,
      "fetches": 1
    },
    "fact checks": {
      "searches": 1,
      "fetches": 1
    },
    "ethics and elections orders": {
      "searches": 1,
      "fetches": 1
    },
    "legal issues": {
      "searches": 1,
      "fetches": 1
    },
    "strongest case": {
      "searches": 0,
      "fetches": 0
    }
  },
  "explanation": ""
}
